Bank Name,Country/Region,Bank URL
Bank of Afghanistan,Afghanistan,https://www.dab.gov.af/
Bank of Albania,Albania,https://www.bankofalbania.org/home/
Bank of Algeria,Algeria,http://www.bank-of-algeria.dz/
National Bank of Angola,Angola,http://www.bna.ao/
Central Bank of Argentina,Argentina,http://www.bcra.gob.ar/default.asp
Central Bank of Armenia,Armenia,http://www.cba.am/
Central Bank of Aruba,Aruba,http://www.cbaruba.org/
Reserve Bank of Australia,Australia,http://www.rba.gov.au/
Central Bank of the Republic of Austria,Austria,https://www.oenb.at/en/
Central Bank of the Republic of Azerbaijan,Azerbaijan,https://www.cbar.az/home?language=en
Central Bank of The Bahamas,Bahamas,http://www.centralbankbahamas.com/
Central Bank of Bahrain,Bahrain,http://www.cbb.gov.bh/
Bangladesh Bank,Bangladesh,https://www.bb.org.bd/
Central Bank of Barbados,Barbados,http://www.centralbank.org.bb/
National Bank of the Republic of Belarus,Belarus,http://www.nbrb.by/engl/
National Bank of Belgium,Belgium,https://www.nbb.be/en
Central Bank of Belize,Belize,http://www.centralbank.org.bz/
Central Bank of West African States (BCEAO),Benin; Burkina Faso; Guinea-Bissau; Ivory Coast; Mali; Niger; Senegal; Togo,https://www.bceao.int/en
Bermuda Monetary Authority,Bermuda,http://www.bma.bm/
Royal Monetary Authority of Bhutan,Bhutan,http://www.rma.org.bt/
Central Bank of Bolivia,Bolivia,https://www.bcb.gob.bo/
Central Bank of Bosnia and Herzegovina,Bosnia and Herzegovina,http://www.cbbh.ba/?lang=en
Bank of Botswana,Botswana,http://www.bankofbotswana.bw/
Central Bank of Brazil,Brazil,https://www.bcb.gov.br/en
Brunei Darussalam Central Bank,Brunei Darussalam,https://www.bdcb.gov.bn/
Bulgarian National Bank,Bulgaria,http://www.bnb.bg/
Bank of the Republic of Burundi,Burundi,https://www.brb.bi/en
National Bank of Cambodia,Cambodia,https://www.nbc.org.kh/english/
Bank of Central African States,Cameroon; Central African Republic; Chad; Congo; Equatorial Guinea; Gabon,https://www.beac.int/
Bank of Canada,Canada,http://www.bankofcanada.ca/
Bank of Cape Verde,Cape Verde,http://www.bcv.cv/
Cayman Islands Monetary Authority,Cayman Islands,http://www.cimoney.com.ky/
Central Bank of Chile,Chile,https://www.bcentral.cl/en/web/banco-central/home
The People's Bank of China,China,http://www.pbc.gov.cn/en/3688006/index.html
Central Bank of Colombia,Colombia,http://www.banrep.gov.co/en
Central Bank of Congo,Congo the Democratic Republic of the,https://www.bcc.cd/
Central Bank of Costa Rica,Costa Rica,https://www.bccr.fi.cr/en
Croatian National Bank,Croatia,http://www.hnb.hr/home
Central Bank of Cuba,Cuba,https://www.bc.gob.cu/
Central Bank of Curaçao and Sint Maarten,Curaçao,http://www.centralbank.cw/
Central Bank of Cyprus,Cyprus,https://www.centralbank.cy/en//home
Czech National Bank,Czech Republic,http://www.cnb.cz/en/index.html
Danmarks Nationalbank,Denmark,http://www.nationalbanken.dk/
Central Bank of the Dominican Republic,Dominican Republic,http://www.bancentral.gov.do/
Central Bank of Ecuador,Ecuador,https://www.bce.fin.ec/en
Central Bank of Egypt,Egypt,https://www.cbe.org.eg/en
Central Reserve Bank of El Salvador,El Salvador,http://www.bcr.gob.sv/
Bank of Estonia,Estonia,http://www.eestipank.ee/en
The Central Bank of Eswatini,Eswatini,http://www.centralbank.org.sz/
National Bank of Ethiopia,Ethiopia,http://www.nbe.gov.et/
European Central Bank,Euro area,http://www.ecb.europa.eu/
Reserve Bank of Fiji,Fiji,http://www.rbf.gov.fj/
Bank of Finland,Finland,http://www.suomenpankki.fi/en/
Bank of France,France,https://www.banque-france.fr/en
Central Bank of The Gambia,Gambia The,http://www.cbg.gm/
National Bank of Georgia,Georgia,https://www.nbg.gov.ge/en
Deutsche Bundesbank,Germany,http://www.bundesbank.de/
Bank of Ghana,Ghana,http://www.bog.gov.gh/
Bank of Greece,Greece,https://www.bankofgreece.gr/en
Bank of Guatemala,Guatemala,http://www.banguat.gob.gt/
Central Bank of the Republic of Guinea,Guinea,http://www.bcrg-guinee.org/
Bank of Guyana,Guyana,http://www.bankofguyana.org.gy/
Bank of the Republic of Haiti,Haiti,https://www.brh.ht/
Central Bank of Honduras,Honduras,https://www.bch.hn/en
Hong Kong Monetary Authority,Hong Kong SAR,https://www.hkma.gov.hk/eng
Magyar Nemzeti Bank,Hungary,http://english.mnb.hu/
Central Bank of Iceland,Iceland,https://www.cb.is/
Reserve Bank of India,India,http://www.rbi.org.in/home.aspx
Bank Indonesia,Indonesia,http://www.bi.go.id/en/
The Central Bank of the Islamic Republic of Iran,Iran Islamic Republic of,http://www.cbi.ir/default_en.aspx
Central Bank of Iraq,Iraq,https://cbi.iq/
Central Bank of Ireland,Ireland,http://www.centralbank.ie/
Bank of Israel,Israel,https://www.boi.org.il/en/
Bank of Italy,Italy,https://www.bancaditalia.it/homepage/index.html?com.dotmarketing.htmlpage.language=1
Bank of Jamaica,Jamaica,http://www.boj.org.jm/
Bank of Japan,Japan,http://www.boj.or.jp/en/
Central Bank of Jordan,Jordan,http://www.cbj.gov.jo/
National Bank of Kazakhstan,Kazakhstan,https://nationalbank.kz/en
Central Bank of Kenya,Kenya,http://www.centralbank.go.ke/
Bank of Korea,Korea Republic of,https://www.bok.or.kr/eng/main/main.do
Central Bank of the Republic of Kosovo,Kosovo,https://bqk-kos.org/?lang=en
Central Bank of Kuwait,Kuwait,http://www.cbk.gov.kw/
National Bank of the Kyrgyz Republic,Kyrgyzstan,https://www.nbkr.kg/index.jsp?lang=eng
Bank of the Lao PDR,Lao People's Democratic Republic,https://www.bol.gov.la/en/index
Bank of Latvia,Latvia,https://www.bank.lv/en/
Central Bank of Lebanon,Lebanon,http://www.bdl.gov.lb/
Central Bank of Lesotho,Lesotho,http://www.centralbank.org.ls/
Central Bank of Liberia,Liberia,http://www.cbl.org.lr/
Central Bank of Libya,Libya State of,https://cbl.gov.ly/en/
Bank of Lithuania,Lithuania,https://www.lb.lt/en/
Central Bank of Luxembourg,Luxembourg,https://www.bcl.lu/en/index.html
Monetary Authority of Macao,Macao SAR,https://www.amcm.gov.mo/en/
Banky Foiben'i Madagasikara,Madagascar,https://www.banky-foibe.mg/
Reserve Bank of Malawi,Malawi,https://www.rbm.mw/
Central Bank of Malaysia,Malaysia,http://www.bnm.gov.my/
Maldives Monetary Authority,Maldives,http://www.mma.gov.mv/
Central Bank of Malta,Malta,http://www.centralbankmalta.org/
Bank of Mauritius,Mauritius,http://www.bom.mu/
Bank of Mexico,Mexico,https://www.banxico.org.mx/indexen.html
National Bank of Moldova,Moldova Republic of,http://www.bnm.md/en
Bank of Mongolia,Mongolia,https://www.mongolbank.mn/en/
Central Bank of Montenegro,Montenegro,https://www.cbcg.me/en
Bank Al-Maghrib (Central Bank of Morocco),Morocco,http://www.bkam.ma/en
Bank of Mozambique,Mozambique,http://www.bancomoc.mz/
Central Bank of Myanmar,Myanmar,http://www.cbm.gov.mm/
Bank of Namibia,Namibia,http://www.bon.com.na/
Central Bank of Nepal (Nepal Rastra Bank),Nepal,http://www.nrb.org.np/
De Nederlandsche Bank,Netherlands,https://www.dnb.nl/en
Reserve Bank of New Zealand,New Zealand,http://www.rbnz.govt.nz/
Central Bank of Nicaragua,Nicaragua,http://www.bcn.gob.ni/
Central Bank of Nigeria,Nigeria,http://www.cbn.gov.ng/
National Bank of the Republic of North Macedonia,North Macedonia Republic of,https://www.nbrm.mk/pocetna-en.nspx
Central Bank of Norway,Norway,https://www.norges-bank.no/en/
Central Bank of Oman,Oman,http://www.cbo.gov.om/
Eastern Caribbean Central Bank,Organization of Eastern Caribbean States (OECS),http://www.eccb-centralbank.org/
State Bank of Pakistan,Pakistan,http://www.sbp.org.pk/
Palestine Monetary Authority,Palestine,https://www.pma.ps/en/
National Bank of Panama (Banco Nacional de Panamá),Panama,https://www.banconal.com.pa/
Bank of Papua New Guinea,Papua New Guinea,http://www.bankpng.gov.pg/
Central Bank of Paraguay,Paraguay,http://www.bcp.gov.py/
Central Reserve Bank of Peru,Peru,http://www.bcrp.gob.pe/
Central Bank of the Philippines (Bangko Sentral ng Pilipinas),Philippines,http://www.bsp.gov.ph/
Narodowy Bank Polski,Poland,https://nbp.pl/en/
Banco de Portugal,Portugal,https://www.bportugal.pt/en
Qatar Central Bank,Qatar,http://www.qcb.gov.qa/
National Bank of Romania,Romania,https://www.bnro.ro/
Central Bank of the Russian Federation,Russian Federation,http://www.cbr.ru/eng/
National Bank of Rwanda,Rwanda,http://www.bnr.rw/
Central Bank of Samoa,Samoa,http://www.cbs.gov.ws/
Central Bank of the Republic of San Marino,San Marino,https://www.bcsm.sm/
Saudi Central Bank,Saudi Arabia,https://www.sama.gov.sa/en-us
National Bank of Serbia,Serbia,https://nbs.rs/en/indeks/index.html
Central Bank of Seychelles,Seychelles,http://www.cbs.sc/
Bank of Sierra Leone,Sierra Leone,http://www.bsl.gov.sl/
Monetary Authority of Singapore,Singapore,http://www.mas.gov.sg/
National Bank of Slovakia,Slovakia,http://www.nbs.sk/en/home
Bank of Slovenia,Slovenia,http://www.bsi.si/en/
Central Bank of Solomon Islands,Solomon Islands,https://www.cbsi.com.sb/
South African Reserve Bank,South Africa,http://www.resbank.co.za/
Bank of Spain,Spain,http://www.bde.es/homee.htm
Central Bank of Sri Lanka,Sri Lanka,http://www.cbsl.gov.lk/
Bank of Sudan,Sudan,http://www.cbos.gov.sd/en
Central Bank of Suriname,Suriname,http://www.cbvs.sr/
Sveriges Riksbank,Sweden,https://www.riksbank.se/en-gb/
Swiss National Bank,Switzerland,http://www.snb.ch/
Central Bank of Syria,Syrian Arab Republic,https://cb.gov.sy/
National Bank of the Republic of Tajikistan,Tajikistan,https://nbt.tj/en/
Bank of Tanzania,Tanzania United Republic of,https://www.bot.go.tz/
Bank of Thailand,Thailand,https://www.bot.or.th/english
National Reserve Bank of Tonga,Tonga,http://www.reservebank.to/
Central Bank of Trinidad and Tobago,Trinidad and Tobago,http://www.central-bank.org.tt/
Central Bank of Tunisia,Tunisia,https://www.bct.gov.tn/
Central Bank of the Republic of Türkiye,Türkiye,https://www.tcmb.gov.tr/
Central Bank of Turkmenistan,Turkmenistan,https://www.cbt.tm/en
Bank of Uganda,Uganda,http://www.bou.or.ug/
National Bank of Ukraine,Ukraine,https://bank.gov.ua/en/
Central Bank of the United Arab Emirates,United Arab Emirates,https://www.centralbank.ae/en
Bank of England,United Kingdom,http://www.bankofengland.co.uk/
Federal Reserve Bank of Atlanta,United States,http://www.frbatlanta.org/
Federal Reserve Bank of Boston,United States,https://www.bostonfed.org/
Federal Reserve Bank of Chicago,United States,http://www.chicagofed.org/
Federal Reserve Bank of Cleveland,United States,http://www.clevelandfed.org/
Federal Reserve Bank of Dallas,United States,http://www.dallasfed.org/
Federal Reserve Bank of Kansas City,United States,http://www.kansascityfed.org/
Federal Reserve Bank of Minneapolis,United States,http://www.minneapolisfed.org/
Federal Reserve Bank of New York,United States,http://www.newyorkfed.org/
Federal Reserve Bank of Philadelphia,United States,http://www.philadelphiafed.org/
Federal Reserve Bank of Richmond,United States,http://richmondfed.org/
Federal Reserve Bank of San Francisco,United States,http://www.frbsf.org/
Federal Reserve Bank of St Louis,United States,http://www.stlouisfed.org/
Board of Governors of the Federal Reserve System,United States,http://www.federalreserve.gov/
Central Bank of Uruguay,Uruguay,https://www.bcu.gub.uy/ingles
Central Bank of the Republic of Uzbekistan,Uzbekistan,https://cbu.uz/en/
Reserve Bank of Vanuatu,Vanuatu,http://www.rbv.gov.vu/
Central Bank of Venezuela,Venezuela,http://www.bcv.org.ve/
State Bank of Vietnam,Vietnam,https://www.sbv.gov.vn/webcenter/portal/en
Central Bank of Yemen,Yemen,https://cby-ye.com/
Bank of Zambia,Zambia,https://www.boz.zm/
Reserve Bank of Zimbabwe,Zimbabwe,http://www.rbz.co.zw/